{
  "schema_version": 1,
  "corpus_id": "koguard-pf005-common-exact-fp-reaudit-v1",
  "source_corpus_sha256": "a140663bdf4015c896c60acaff6642d2a91067d619e67a466fa2a9c8ba19ae78",
  "batch_case_count": 2,
  "batch_counts": {
    "positive": 2,
    "hard-negative": 0,
    "review": 0
  },
  "corpus_counts": {
    "positive": 2,
    "hard-negative": 0,
    "review": 0
  },
  "quality_counts": {
    "double_reviewed": 2,
    "consensus": 2,
    "disagreement": 0,
    "privacy_excluded": 0,
    "pending_privacy": 0
  },
  "slice_counts": {
    "benign-substring": 2
  },
  "gold_ready": false
}
